### ISSUE TITLE
AWS_* env variables ignored

### ISSUE THREAD

**Issue by baznikin** [CrunchyData/pg_parquet#174]
Hello!
Trying to make `pg_parquet` (tag `v0.5.1`) work in our environment. We run Postgres under Zalando operator and use wal-g for WAL archiving, so we already have almost all variables available at server start. I added missing `AWS_ENDPOINT_URL`, tried to add `AWS_REGION`, played around with `AWS_SESSION_TOKEN` - but still - AWS S3 client tried to reach out `http://169.254.169.254` and ignores environment variables. What I did wrong?

```
 env | grep -i aws
AWS_ENDPOINT=https://fra1.digitaloceanspaces.com
CLONE_AWS_ACCESS_KEY_ID=YYY
AWS_REGION=fra1
CLONE_AWS_ENDPOINT=https://fra1.digitaloceanspaces.com
AWS_SECRET_ACCESS_KEY=XXX
AWS_ALLOW_HTTP=true
AWS_ACCESS_KEY_ID=YYY
AWS_ENDPOINT_URL=https://fra1.digitaloceanspaces.com
CLONE_AWS_SECRET_ACCESS_KEY=XXX
```

Same variables are available from postgesql process:
```
test=# \getenv ttt AWS_ENDPOINT_URL
test=# \echo :ttt 
https://fra1.digitaloceanspaces.com
```

When I try to access S3 bucket I got an error:
```
test=# COPY (SELECT 1) TO 's3://ZZZ-historical-data/data.parquet' WITH (format 'parquet');
ERROR:  failed to load aws credentials: ProviderError(ProviderError { source: FailedToLoadToken(FailedToLoadToken { source: ServiceError(ServiceError { source: TokenError { kind: NoTtl }, raw: Response { status: StatusCode(404), headers: Headers { headers: {"date": HeaderValue { _private: H1("Mon, 08 Jun 2026 19:48:03 GMT") }, "content-length": HeaderValue { _private: H1("9") }, "content-type": HeaderValue { _private: H1("text/plain; charset=utf-8") }, "connection": HeaderValue { _private: H1("close") }} }, body: SdkBody { inner: Once(Some(b"not found")), retryable: true }, extensions: Extensions { extensions_02x: Extensions, extensions_1x: Extensions } } }) }) })
```

at same time only traffic I see is to 169.254.169.254:
```
19:41:46.981163 IP test-parquet-0.test-parquet.test.svc.cluster.local.46488 > 169.254.169.254.http: Flags [S], seq 3980775066, win 64240, options [mss 1460,sackOK,TS val 3279928725 ecr 0,nop,wscale 7], length 0
19:41:46.982830 IP 169.254.169.254.http > test-parquet-0.test-parquet.test.svc.cluster.local.46488: Flags [S.], seq 1343563026, ack 3980775067, win 65160, options [mss 1460,sackOK,TS val 1861274199 ecr 3279928725,nop,wscale 7], length 0
19:41:46.982853 IP test-parquet-0.test-parquet.test.svc.cluster.local.46488 > 169.254.169.254.http: Flags [.], ack 1, win 502, options [nop,nop,TS val 3279928727 ecr 1861274199], length 0
19:41:46.982966 IP test-parquet-0.test-parquet.test.svc.cluster.local.46488 > 169.254.169.254.http: Flags [P.], seq 1:265, ack 1, win 502, options [nop,nop,TS val 3279928727 ecr 1861274199], length 264: HTTP: PUT /latest/api/token HTTP/1.1
```

**Comment by baznikin** [comment]
It is Patroni configuration issue - almost all variables are removed from env
```
postgres@test-parquet-0:~$ ps ax
    PID TTY      STAT   TIME COMMAND
      1 ?        Ss     0:00 /usr/bin/dumb-init -c --rewrite 1:0 -- /bin/sh /launch.sh
      7 ?        S      0:00 /bin/sh /launch.sh
     25 ?        S      0:00 /usr/bin/runsvdir -P /etc/service
     31 ?        Ss     0:00 runsv patroni
     32 ?        Ss     0:00 runsv cron
     33 ?        Ss     0:00 runsv pgqd
     34 ?        S      0:00 /usr/bin/pgqd /home/postgres/pgq_ticker.ini
     35 ?        S      0:00 /usr/sbin/cron -f
     36 ?        Sl     0:40 /usr/bin/python3 /usr/local/bin/patroni /home/postgres/postgres.yml
     64 ?        S      0:07 /usr/lib/postgresql/17/bin/postgres -D /home/postgres/pgdata/pgroot/data --config-file=/home/postgres/pgdata/pgroot/data/postgresql.conf --listen_addresses=* --port=5432 --cluster_na
     66 ?        Ss     0:00 postgres: test-parquet: logger 
     67 ?        Ss     0:00 postgres: test-parquet: checkpointer 
     68 ?        Ss     0:00 postgres: test-parquet: background writer 
     70 ?        Ssl    1:35 postgres: test-parquet: bg_mon 
    204 ?        Ss     0:03 postgres: test-parquet: postgres postgres [local] idle
    316 ?        Ss     0:00 postgres: test-parquet: walwriter 
    317 ?        Ss     0:00 postgres: test-parquet: autovacuum launcher 
    318 ?        Ss     0:00 postgres: test-parquet: archiver last was 0000000C0000000000000041
    319 ?        Ss     0:02 postgres: test-parquet: pg_cron launcher 
    321 ?        Ss     0:00 postgres: test-parquet: logical replication launcher 
    395 ?        Ss     0:00 postgres: test-parquet: postgres postgres [local] idle
    433 pts/0    Ss+    0:00 /usr/lib/postgresql/17/bin/psql -U postgres test
    439 ?        Ss     0:00 postgres: test-parquet: postgres test [local] idle
  12618 pts/1    Ss     0:00 bash
  12662 pts/1    S      0:00 su postgres
  12663 pts/1    S      0:00 bash
  12757 pts/1    R+     0:00 ps ax
postgres@test-parquet-0:~$ cat /proc/64/environ | tr '\0' '\n'
POD_IP=10.244.4.96
HOSTNAME=test-parquet-0
PGHOME=/home/postgres
PATH=/usr/local/sbin:/usr/local/bin:/usr/sbin:/usr/bin:/sbin:/bin:/usr/lib/postgresql/17/bin
POD_NAMESPACE=test
LC_ALL=en_US.utf-8
HOME=/home/postgres
```
